{
  "$schema": "https://bdekoz.github.io/izzi.public/examples/seedance2/ten-scene-project.proposed.schema.json",
  "schema_version": 1,
  "project_id": "pacific-instrument-ten-scene",
  "defaults": {
    "canvas": {
      "width_px": 1280,
      "height_px": 720,
      "background": "#081820",
      "safe_area_px": {
        "top": 58,
        "right": 64,
        "bottom": 58,
        "left": 64
      }
    },
    "timeline": {
      "frame_rate": {
        "numerator": 30,
        "denominator": 1
      },
      "frame_count": 300,
      "duration_seconds": 10
    },
    "typography": {
      "editorial_family": "Atkinson Hyperlegible Next",
      "data_family": "Atkinson Hyperlegible Mono",
      "weight": 800,
      "size_px": 76
    },
    "delivery": {
      "adapter": "seedance2ai-v1",
      "submit": false,
      "quality_tier": "standard",
      "channel": "standard",
      "aspect_ratio": "16:9",
      "duration": "10",
      "resolution": "720p",
      "generate_audio": false,
      "fixed_lens": true
    },
    "output": {
      "root": "build/pacific-instrument-ten-scene",
      "clip_pattern": "{scene_id}-final.mkv",
      "poster_pattern": "{scene_id}-poster.png",
      "manifest": "storyboard-manifest.json"
    }
  },
  "assets": [],
  "scenes": [
    {
      "scene_id": "scene-01",
      "description": "An exact Pacific Instrument title field opens the sequence before yielding to a wide predawn ocean horizon.",
      "prompt": "A wide predawn Pacific Ocean horizon, almost still water, a narrow cyan line of first light, restrained documentary cinematography, slow forward camera drift, deep blue and warm-white palette.",
      "constraints": [
        "no watermark",
        "no logo",
        "no subtitles after the supplied opening frame",
        "stable horizon",
        "no unsafe flashing"
      ],
      "reference_asset_ids": [],
      "seed": 1001,
      "title_frame": {
        "text": "PACIFIC INSTRUMENT",
        "subtitle": "SCENE 01 / SIGNAL AT FIRST LIGHT",
        "accessible_name": "Pacific Instrument opening title",
        "description": "Warm-white title and cyan rule on a deep Pacific blue field.",
        "field_background": "#173A55",
        "color": "#FCFBF7",
        "accent_color": "#7FE1D1",
        "hold_frames": 45,
        "use_as_provider_start_frame": true
      },
      "transition_in": {
        "kind": "hamonshu",
        "mode": "mask-reveal",
        "start_frame": 45,
        "frame_count": 75,
        "reduced_motion": "cross-fade",
        "hamonshu": {
          "pattern": {
            "first_page": 1,
            "last_page": 1,
            "motif": 1
          },
          "density": 1.0,
          "curvature": 1.3,
          "phase_radians": 0.0,
          "rotation_radians": 0.0,
          "reflected": false,
          "samples_per_curve": 48
        }
      },
      "accessibility": {
        "accessible_name": "Predawn Pacific horizon",
        "long_description": "A nearly black-blue ocean meets a level horizon. A thin cyan dawn line grows gradually without rapid luminance changes.",
        "motion_note": "Slow forward drift and a gradual wave-mask reveal.",
        "flash_policy": "no-unsafe-flashing"
      }
    },
    {
      "scene_id": "scene-02",
      "description": "The camera descends toward a single scientific buoy whose sensors begin recording the changing surface conditions.",
      "prompt": "A solitary scientific ocean buoy at blue hour, visible instruments and antenna, realistic water movement, slow descending camera, quiet technical documentary style, no people.",
      "constraints": [
        "no watermark",
        "no logo",
        "no subtitles",
        "physically plausible buoy motion",
        "no unsafe flashing"
      ],
      "reference_asset_ids": [],
      "seed": 1002,
      "title_frame": {
        "text": "SURFACE RECORD",
        "subtitle": "SCENE 02 / BUOY AND WEATHER",
        "accessible_name": "Surface Record scene title",
        "description": "Dark title on warm white with a deep-blue structural rule.",
        "field_background": "#FCFBF7",
        "color": "#14171A",
        "accent_color": "#173A55",
        "hold_frames": 30,
        "use_as_provider_start_frame": false
      },
      "transition_in": {
        "kind": "fade",
        "mode": "cross-fade",
        "start_frame": 30,
        "frame_count": 45,
        "reduced_motion": "cross-fade"
      },
      "accessibility": {
        "accessible_name": "Scientific buoy recording ocean conditions",
        "long_description": "A yellow scientific buoy rises and falls gently while small instrument housings and an antenna remain clearly visible.",
        "motion_note": "Gentle water movement and a slow camera descent.",
        "flash_policy": "no-unsafe-flashing"
      }
    },
    {
      "scene_id": "scene-03",
      "description": "A roulette aperture moves the view below the surface to reveal a vertical column of measured temperature and light.",
      "prompt": "Underwater descent beneath a scientific buoy, clear vertical water column, suspended particles, sunlight attenuating with depth, calm camera, scientifically plausible color shift from cyan to deep blue.",
      "constraints": [
        "no watermark",
        "no logo",
        "no subtitles",
        "no fantasy sea creatures",
        "no unsafe flashing"
      ],
      "reference_asset_ids": [],
      "seed": 1003,
      "title_frame": {
        "text": "WATER COLUMN",
        "subtitle": "SCENE 03 / LIGHT AND TEMPERATURE",
        "accessible_name": "Water Column scene title",
        "description": "Warm-white title on deep blue with a red roulette accent.",
        "field_background": "#173A55",
        "color": "#FCFBF7",
        "accent_color": "#D33F49",
        "hold_frames": 30,
        "use_as_provider_start_frame": false
      },
      "transition_in": {
        "kind": "roulette",
        "mode": "iris-mask",
        "start_frame": 30,
        "frame_count": 75,
        "reduced_motion": "cross-fade",
        "roulette": {
          "kind": "hypotrochoid",
          "fixed_radius": 5,
          "rolling_radius": 2,
          "point_distance": 2.5,
          "phase_radians": 0.0,
          "samples_per_turn": 192,
          "origin": "center"
        }
      },
      "accessibility": {
        "accessible_name": "Descent through an ocean water column",
        "long_description": "The view descends from bright cyan surface water into darker blue depth while particles drift slowly past the camera.",
        "motion_note": "Expanding roulette iris followed by a steady downward camera path.",
        "flash_policy": "no-unsafe-flashing"
      }
    },
    {
      "scene_id": "scene-04",
      "description": "Hamonshu lines become current traces around a seabed instrument package and a cable carrying measurements toward shore.",
      "prompt": "A seabed scientific instrument package beside a fiber-optic cable, low-angle underwater documentary view, slow current moving fine sediment, precise engineered forms, restrained blue-gray palette.",
      "constraints": [
        "no watermark",
        "no logo",
        "no subtitles",
        "do not deform the instrument housing",
        "no unsafe flashing"
      ],
      "reference_asset_ids": [],
      "seed": 1004,
      "title_frame": {
        "text": "SUBSEA LINK",
        "subtitle": "SCENE 04 / SENSOR TO SHORE",
        "accessible_name": "Subsea Link scene title",
        "description": "Warm-white title and cyan accent over a dark ocean field.",
        "field_background": "#081820",
        "color": "#FCFBF7",
        "accent_color": "#7FE1D1",
        "hold_frames": 30,
        "use_as_provider_start_frame": false
      },
      "transition_in": {
        "kind": "hamonshu",
        "mode": "wave-wipe",
        "start_frame": 30,
        "frame_count": 75,
        "reduced_motion": "cross-fade",
        "hamonshu": {
          "pattern": {
            "first_page": 3,
            "last_page": 3,
            "motif": 1
          },
          "density": 1.1,
          "curvature": 0.9,
          "phase_radians": 0.2,
          "rotation_radians": 0.0,
          "reflected": false,
          "samples_per_curve": 48
        }
      },
      "accessibility": {
        "accessible_name": "Seabed sensor and communications cable",
        "long_description": "A rectangular instrument package sits on the seabed beside a cable that exits the frame toward shore. Fine sediment moves slowly in one direction.",
        "motion_note": "A directional wave wipe and slow lateral current.",
        "flash_policy": "no-unsafe-flashing"
      }
    },
    {
      "scene_id": "scene-05",
      "description": "The cable reaches a quiet shore station where incoming observations resolve into restrained lines and numeric records.",
      "prompt": "Interior of a small coastal monitoring station at dawn, cable termination and scientific instruments, screens showing restrained line traces without legible fabricated data, slow lateral camera move, editorial technical atmosphere.",
      "constraints": [
        "no watermark",
        "no logo",
        "no generated words or fake labels on screens",
        "no unsafe flashing"
      ],
      "reference_asset_ids": [],
      "seed": 1005,
      "title_frame": {
        "text": "SHORE STATION",
        "subtitle": "SCENE 05 / OBSERVATIONS ARRIVE",
        "accessible_name": "Shore Station scene title",
        "description": "Near-black title on warm white with a Pacific blue rule.",
        "field_background": "#FCFBF7",
        "color": "#14171A",
        "accent_color": "#173A55",
        "hold_frames": 30,
        "use_as_provider_start_frame": false
      },
      "transition_in": {
        "kind": "fade",
        "mode": "cross-fade",
        "start_frame": 30,
        "frame_count": 45,
        "reduced_motion": "cross-fade"
      },
      "accessibility": {